{
  "$schema": "../../../schemas/prop.schema.json",
  "id": "prop:hay-bale",
  "kind": "prop",
  "grid": { "w": 16, "h": 12 },
  "anchor": { "x": 8, "y": 12 },
  "solid": false,
  "states": {
    "default": {
      "rows": [
        "................",
        "....XXXXXXXX....",
        "...XDDDDDDDDX...",
        "..XDDdDdDdDDDX..",
        ".XDDGGGGGGDDDX..",
        ".XDDGgGgGgGDDDX.",
        ".XDDGGDGGDGGDDX.",
        ".XDDgGgGgGgDDX..",
        "..XDDDDDDDDDDX..",
        "...XXBBBBBBXX...",
        ".....XXXXXX.....",
        "................"
      ]
    }
  },
  "recolorChannels": ["X", "D", "d", "G", "g", "B"],
  "defaultPalette": "palette:base",
  "koota": { "traits": ["Transform", "Sprite", "DepthSorted"] }
}
