{
  "$schema": "../../../schemas/prop.schema.json",
  "id": "prop:mossy-waystone",
  "kind": "prop",
  "grid": { "w": 16, "h": 18 },
  "anchor": { "x": 8, "y": 18 },
  "solid": false,
  "interaction": {
    "verb": "read",
    "method": "action-button",
    "sfx": "interact",
    "dialogue": { "bank": "dlgbank:oldwood-waystone", "slot": "riddle" }
  },
  "states": {
    "default": {
      "rows": [
        "................",
        "......XXXX......",
        ".....XCCCCX.....",
        "....XCCcCCCX....",
        "...XCCCECCcX....",
        "...XCCEeECCX....",
        "...XCCCcCCCX....",
        "...XCCCGCCCX....",
        "...XCCCCcCCX....",
        "...XCCEeECCX....",
        "...XCCCcCCCX....",
        "....XCCCCCX.....",
        "....XCCcCCX.....",
        ".....XCCCX......",
        "....XXEEEEX.....",
        "...XeeEeeEX.....",
        "....XXXXXX......",
        "................"
      ]
    }
  },
  "recolorChannels": ["X", "C", "c", "E", "e", "G"],
  "defaultPalette": "palette:base",
  "koota": { "traits": ["Transform", "Sprite", "DepthSorted"] }
}
