{
  "$schema": "../../../schemas/prop.schema.json",
  "id": "prop:wind-ribbon-cairn",
  "kind": "prop",
  "grid": { "w": 24, "h": 18 },
  "anchor": { "x": 12, "y": 18 },
  "solid": false,
  "states": {
    "default": {
      "rows": [
        "........................",
        "..........YY............",
        ".........YyyY...........",
        "..........YY............",
        "......XXXX..XXXX........",
        ".....XSSSSXXSSSSX.......",
        "....XSSssSSSSssSSX......",
        ".....XSSSSSSSSSSX.......",
        "......XXSSSSSSXX........",
        "....RRRRR....BBBBB......",
        "...RrRrR......BbBbB.....",
        "....RRR........BBB......",
        "........................",
        "........................",
        "........................",
        "........................",
        "........................",
        "........................"
      ]
    }
  },
  "recolorChannels": ["X", "Y", "y", "S", "s", "R", "r", "B", "b"],
  "defaultPalette": "palette:base",
  "koota": { "traits": ["Transform", "Sprite", "DepthSorted"] }
}
