{
  "$schema": "../../../schemas/prop.schema.json",
  "id": "prop:seed-crates",
  "kind": "prop",
  "grid": { "w": 16, "h": 14 },
  "anchor": { "x": 8, "y": 14 },
  "solid": false,
  "states": {
    "default": {
      "rows": [
        "................",
        "...EEEE.EE......",
        "..EeeEeeeE......",
        "..XDDDDDDX......",
        ".XDDDddDDDX.....",
        ".XDDDBBDDDX.....",
        ".XXXXXXXXXX.....",
        "..XBBBBBBX......",
        ".XBBbBBbBBX.....",
        ".XBBGBBGBBX.....",
        ".XBBBBBBBBX.....",
        "..XXXXXXXX......",
        "................",
        "................"
      ]
    }
  },
  "recolorChannels": ["X", "E", "e", "D", "d", "B", "b", "G"],
  "defaultPalette": "palette:base",
  "koota": { "traits": ["Transform", "Sprite", "DepthSorted"] }
}
