{
  "$schema": "../../../schemas/prop.schema.json",
  "id": "prop:sunken-pillar-shadow",
  "kind": "prop",
  "grid": { "w": 24, "h": 18 },
  "anchor": { "x": 12, "y": 18 },
  "solid": false,
  "states": {
    "default": {
      "rows": [
        "........................",
        ".....XXXX.......XXXX....",
        "....XCCCCX.....XCCCCX...",
        "....XCccCX.....XCccCX...",
        ".....XCCX.......XCCX....",
        "......XX.........XX.....",
        "......BB.........BB.....",
        "......Bb.........Bb.....",
        "......BB.........BB.....",
        "......Bb.........Bb.....",
        "......BB.........BB.....",
        ".....XBBX.......XBBX....",
        "....XBBBBX.....XBBBBX...",
        "...XBBbbBBXXXXXBBbbBBX..",
        "....XXRRRrrrrRRRXX......",
        "......RR......RR........",
        "........................",
        "........................"
      ]
    }
  },
  "recolorChannels": ["X", "C", "c", "B", "b", "R", "r"],
  "defaultPalette": "palette:base",
  "koota": { "traits": ["Transform", "Sprite", "DepthSorted"] }
}
