{
  "$schema": "../../../schemas/prop.schema.json",
  "id": "prop:vine-trellis",
  "kind": "prop",
  "grid": { "w": 16, "h": 24 },
  "anchor": { "x": 8, "y": 24 },
  "solid": false,
  "states": {
    "default": {
      "rows": [
        "................",
        "......XX........",
        ".....XBBX.......",
        "....XBBBBX......",
        "...XBBEEBBX.....",
        "..XBBEeEEBBX....",
        "..XBEEPPeEBX....",
        "..XBEeEEeEBX....",
        "..XBBEEGGBBX....",
        "..XbBBBBBBbX....",
        "..XbEeeeEEbX....",
        "..XbEePPEEbX....",
        "..XbEEeeEEbX....",
        "..XbBBBBBBbX....",
        "..XbB....BbX....",
        "..XbB....BbX....",
        "..XbB....BbX....",
        "..XbB....BbX....",
        "..XbB....BbX....",
        "..XX......XX....",
        "................",
        "................",
        "................",
        "................"
      ]
    }
  },
  "recolorChannels": ["X", "B", "b", "E", "e", "P", "G"],
  "defaultPalette": "palette:base",
  "koota": { "traits": ["Transform", "Sprite", "DepthSorted"] }
}
