{
  "$schema": "../../../schemas/prop.schema.json",
  "id": "prop:flower-cart",
  "kind": "prop",
  "grid": { "w": 16, "h": 16 },
  "anchor": { "x": 8, "y": 16 },
  "solid": false,
  "states": {
    "default": {
      "rows": [
        "................",
        "....EEEEEE......",
        "...EPPGGPPE.....",
        "..XEEEEEEEEX....",
        "..XBBBBBBBBX....",
        ".XBDDDDDDDDBX...",
        ".XBBBBBBBBBBX...",
        "..XX......XX....",
        "..XbX....XbX....",
        "...XX....XX.....",
        "................",
        "................",
        "................",
        "................",
        "................",
        "................"
      ]
    }
  },
  "recolorChannels": ["X", "E", "P", "G", "B", "D", "b"],
  "defaultPalette": "palette:base",
  "koota": { "traits": ["Transform", "Sprite", "DepthSorted"] }
}
