{
  "$schema": "../../../schemas/prop.schema.json",
  "id": "prop:castle-banner",
  "kind": "prop",
  "grid": { "w": 16, "h": 16 },
  "anchor": { "x": 8, "y": 16 },
  "solid": false,
  "states": {
    "default": {
      "rows": [
        ".......XX.......",
        ".......XX.......",
        "......XYYX......",
        ".....XYYYYX.....",
        ".....XYGGYX.....",
        ".....XYRRYX.....",
        ".....XYRRYX.....",
        ".....XYGGYX.....",
        ".....XYYYYX.....",
        ".....XYYYYX.....",
        "......XYYX......",
        ".......XX.......",
        ".......XX.......",
        "......XbbX......",
        ".....XBBBBX.....",
        "................"
      ]
    }
  },
  "recolorChannels": ["X", "Y", "G", "R", "b", "B"],
  "defaultPalette": "palette:base",
  "koota": { "traits": ["Transform", "Sprite", "DepthSorted"] }
}
