{
  "$schema": "../../../schemas/prop.schema.json",
  "id": "prop:chalk-price-board",
  "kind": "prop",
  "grid": { "w": 24, "h": 18 },
  "anchor": { "x": 12, "y": 18 },
  "solid": false,
  "states": {
    "default": {
      "rows": [
        "........................",
        "........XXXXXX..........",
        ".......XBBBBBBX.........",
        "......XBCGGCCBX.........",
        "......XBCeeCCBX.........",
        "......XBGGCCCBX.........",
        "......XBBBBBBBX.........",
        ".......XbX..XbX.........",
        ".......XbX..XbX.........",
        "......XXbXXXXbXX........",
        ".....XbbBbbbbBbbX.......",
        "......XX......XX........",
        ".......G..G..G..........",
        "........................",
        "........................",
        "........................",
        "........................",
        "........................"
      ]
    }
  },
  "recolorChannels": ["X", "B", "b", "C", "G", "e"],
  "defaultPalette": "palette:base",
  "koota": { "traits": ["Transform", "Sprite", "DepthSorted"] }
}
