{
  "$schema": "../../../schemas/prop.schema.json",
  "id": "prop:castle-shelf",
  "kind": "prop",
  "grid": { "w": 16, "h": 16 },
  "anchor": { "x": 8, "y": 16 },
  "solid": false,
  "states": {
    "default": {
      "rows": [
        "................",
        "..XXXXXXXXXXXX..",
        ".XbbbbbbbbbbbX..",
        ".XbBDBBDBBDBBX..",
        ".XbXXXXXXXXXbX..",
        ".XbYYYYYYYYYbX..",
        ".XbYGGYGGYGYbX..",
        ".XbXXXXXXXXXbX..",
        ".XbCCCCCCCCCbX..",
        ".XbCcCCcCCcCbX..",
        ".XbXXXXXXXXXbX..",
        ".XbbbbbbbbbbbX..",
        "..XXXXXXXXXXXX..",
        "................",
        "................",
        "................"
      ]
    }
  },
  "recolorChannels": ["X", "b", "B", "D", "Y", "G", "C", "c"],
  "defaultPalette": "palette:base",
  "koota": { "traits": ["Transform", "Sprite", "DepthSorted"] }
}
