{
  "$schema": "../../../schemas/prop.schema.json",
  "id": "prop:chest",
  "kind": "prop",
  "grid": { "w": 16, "h": 16 },
  "anchor": { "x": 8, "y": 16 },
  "solid": false,
  "interaction": { "verb": "open", "method": "melee-swing", "sfx": "chest", "once": true },
  "states": {
    "closed": {
      "rows": [
        "................",
        ".....XXXXXX.....",
        "....XGGggGGX....",
        "....XGbbbbGX....",
        "....XgbbbbgX....",
        "....XXgGGgXX....",
        "....XGbbbbGX....",
        "....XGbbbbGX....",
        "....XXXXXX......",
        "................",
        "................",
        "................",
        "................",
        "................",
        "................",
        "................"
      ]
    },
    "open": {
      "drawOps": [
        { "op": "rect", "color": "@B", "x": 2, "y": 8, "w": 12, "h": 8 },
        { "op": "rect", "color": "@G", "x": 4, "y": 10, "w": 8, "h": 2 }
      ]
    }
  },
  "recolorChannels": ["G", "g", "b", "X"],
  "defaultPalette": "palette:base",
  "koota": {
    "traits": ["Transform", "Sprite", "Interactable", "LootContainer", "DepthSorted"]
  }
}
