{
  "$schema": "../../../schemas/prop.schema.json",
  "id": "prop:cottage-facade",
  "kind": "prop",
  "grid": { "w": 24, "h": 24 },
  "anchor": { "x": 12, "y": 24 },
  "solid": false,
  "states": {
    "default": {
      "rows": [
        "........................",
        "..........XX............",
        ".........XbbX...........",
        "........XbbbbX..........",
        ".......XbbbbbbX.........",
        "......XbbbbbbbbX........",
        ".....XbbbbbbbbbbX.......",
        "....XbbbbbbbbbbbbX......",
        "...XbbbbbbbbbbbbbbX.....",
        "..XbbbbbbbbbbbbbbbbX....",
        ".XDDDDDDDDDDDDDDDDX.....",
        "XDDDeDDDDDDDDDeDDDX.....",
        "XDDDLLLLDDLLLLDDDDX.....",
        "XDDDLLLLDDLLLLDDDDX.....",
        "XDDDDDDDXDDDDDDDDDX.....",
        "XDDDDXbbbXDDDDDDDDX.....",
        "XDDDDXbGbXDDDDDeDDX.....",
        "XDDDDXbbbXDDDDDDDDX.....",
        "XDDDDDDDDDDDDDDDDDX.....",
        "XDDDDDDDeeDDDDDDDDX.....",
        "XXXXXXXXXXXXXXXXXXXXXXXX",
        "........................",
        "........................",
        "........................"
      ]
    }
  },
  "recolorChannels": ["X", "b", "B", "D", "e", "L", "g"],
  "defaultPalette": "palette:base",
  "koota": { "traits": ["Transform", "Sprite", "DepthSorted"] }
}
