{
  "$schema": "../../../schemas/prop.schema.json",
  "id": "prop:table",
  "kind": "prop",
  "grid": { "w": 16, "h": 16 },
  "anchor": { "x": 8, "y": 16 },
  "solid": false,
  "states": {
    "default": {
      "rows": [
        "................",
        "................",
        "...XXXXXXXXXX...",
        "..XBBBBBBBBX....",
        "..XBDDBBDDBX....",
        "...XXXXXXXXXX...",
        "....XbX..XbX....",
        "....XbX..XbX....",
        "....XbX..XbX....",
        "....XGX..XGX....",
        "................",
        "................",
        "................",
        "................",
        "................",
        "................"
      ]
    }
  },
  "recolorChannels": ["X", "b", "B", "D", "G"],
  "defaultPalette": "palette:base",
  "koota": { "traits": ["Transform", "Sprite", "DepthSorted"] }
}
